{
  "id": "yt:rick-astley-never-gonna-give-you-up-official-video-4k-remaster",
  "source_type": "youtube",
  "source_url": "https://www.youtube.com/watch?v=dQw4w9WgXcQ",
  "retrieved_at": "2026-03-17T15:25:28.8302437Z",
  "title": "Rick Astley - Never Gonna Give You Up (Official Video) (4K Remaster)",
  "channel": "Rick Astley",
  "language": "en",
  "duration_seconds": 0.0,
  "summary": "Auto-ingested transcript using yt-dlp captions.",
  "keywords": [
    "youtube",
    "transcript",
    "kb-ingest"
  ],
  "claims": [],
  "transcript": "[Music]\r\nWe're no strangers to\r\nlove. You know the rules and so do\r\nI. I feel commitments from what I'm\r\nthinking\r\nof. You wouldn't get this from any other\r\nguy. I just want to tell you how I'm\r\nfeeling. Got to make you understand.\r\nNever going to give you up. I'm going to\r\nlet you down. I'm going to run around\r\nand desert you. I'm going to make\r\nyou say goodbye.\r\nTell a lie and hurt\r\nyou. We've known each other for so\r\nlong. Your heart's been aching, but\r\nyou're too shy to say we don't know\r\nwhat's been going\r\non. We know the game and we're going to\r\nplay. If you ask me how I'm\r\nfeeling, don't tell me your truth. to\r\nsee. I will give\r\nyou\r\naround\r\nyou. I will say\r\ngoodbye and hurt you. I will give\r\naround you. I will leave you. I will say\r\ngoodbye and hurt you.\r\nNever going to give. Never going to\r\ngive.\r\nWe've known each other for so long.\r\nYour heart's been aching, but you're too\r\nshy to say it. We both know what's been\r\ngoing\r\nplay it. I just want to tell you how I'm\r\nNever going to give you up. Never going\r\nto let you down. Never going to run\r\naround and desert you. Heat.\r\nHeat. Heat. Heat.\r\nNever going to tell a lie and hurt you.\r\naround and desert you. Never going to\r\nmake you cry. Never going to say\r\ngoodbye. Never going to say goodbye.",
  "notes": ""
}
